{
  "schema": "shapeforge.reference-assessment/1.0",
  "subject": "stylized humanoid",
  "style": "low-poly fantasy",
  "cameraAzimuth": 20,
  "cameraElevation": 5,
  "detailLevel": "medium",
  "confidence": 0.9,
  "visibleFeatures": ["shoulder armor", "belt"],
  "uncertainties": ["back of cape"]
}
